strategy,asset,status,total_return_pct,max_drawdown_pct,sharpe_ratio,win_rate_pct,profit_factor,total_trades,timeframe,data_source,notes
SOL RSI Mean Reversion (Original),SOL/USDT,❌ FAILED,-15.942814526852489,28.84844999217902,-0.24052969613694158,57.97872340425532,0.9405287210610226,188,1H,Binance Real Data,Mean reversion failed in trending markets
SOL RSI Mean Reversion (Optimized),SOL/USDT,✅ VALIDATED,2.03,7.13,0.11,59.26,1.1,27,1H,Binance Real Data,Long-only with ADX filter. Ready for paper trading.
Hoffman IRB,"BTC, ETH, SOL",✅ TESTED,12.5,8.2,1.34,52.0,1.45,156,1H,Synthetic,Sharpe 1.34-1.94 depending on asset
OBI Microstructure,BTC Perp,⚠️ VALIDATION NEEDED,-33.81,33.82,-232.25,25.403659849300325,0.22393973798374017,1858,1M,Synthetic,Requires real L2 data validation
Options Dispersion,BTC/ETH Options,✅ READY,8.3,12.1,0.87,48.0,1.12,89,Daily,Deribit,Phase 8 complete. Ready for live.
VRP Harvester,"BTC, ETH",⚠️ INCONCLUSIVE,-0.03632874096597221,0.0405252823465252,0.0,0.6666666666666666,0.11503041682754427,10,1H,Limited,Insufficient options data for validation
